question,choices,answer,level,subject
Bronchial breathing is characterized by,"['A. Inspiratory component louder and longer with a gap between expiration and inspiration', 'B. Expiratory component louder and longer with a gap between inspiration and expiration', 'C. Inspiratory component louder and longer with a gap between inspiration and expiration', 'D. Expiratory component louder and longer with a gap between expiration and inspiration']",B. Expiratory component louder and longer with a gap between inspiration and expiration,professional,clinical_knowledge
Which of the following is true about involuntary movements in the arm?,"['A. Alcohol makes the tremor of benign essential tremor worse', 'B. Hemiballismus is due to a stroke causing paralysis of the distal half of the arm', ""C. A 'milkmaid' grip is sometimes found in dystonia"", ""D. Writer's cramp is an example of a focal dystonia""]",D. Writer's cramp is an example of a focal dystonia,professional,clinical_knowledge
What commonly causes skin excoriation?,"['A. A well-fitting pouch.', 'B. Changing the pouch every day.', 'C. Leakage of effluent onto peristomal skin.', 'D. The use of unscented soap to cleanse the skin.']",C. Leakage of effluent onto peristomal skin.,professional,clinical_knowledge
In a patient with chest pain which of these features is most suggestive of a myocardial infarction?,"['A. Very severe pain', 'B. Sweating and vomiting', 'C. Pain has lasted for over a week', 'D. Pain is sharp like a knife']",B. Sweating and vomiting,professional,clinical_knowledge
Which products of ADP degradation increase in concentration in the blood during multiple sprint sports?,"['A. Ammonia, hypoxanthine and uric acid.', 'B. Ammonia, urea and uric acid.', 'C. Ammonia, urea and creatinine.', 'D. Ammonia, urea and creatine.']","A. Ammonia, hypoxanthine and uric acid.",professional,clinical_knowledge
Oxygen is used:,"['A. in glycolysis.', 'B. in the conversion of fatty acids to acetyl CoA.', ""C. in the tricarboxylic acid cycle (Krebs' cycle)."", 'D. in glycogenolysis.']",B. in the conversion of fatty acids to acetyl CoA.,professional,clinical_knowledge
Which of the following is not associated with an increase in the work of breathing?,"['A. Rise in respiratory rate.', 'B. Noisy breathing.', 'C. Increase in the use of accessory muscles.', 'D. A respiratory rate of 16 breaths per minute.']",D. A respiratory rate of 16 breaths per minute.,professional,clinical_knowledge
What is cardiac output?,"['A. Stroke volume × heart rate.', 'B. Systemic vascular resistance × heart rate.', 'C. Blood pressure × heart rate.', 'D. Preload × stroke volume.']",A. Stroke volume × heart rate.,professional,clinical_knowledge
Which of the following is true regarding the examination of the legs?,"['A. Sustained clonus occurs with hypotonia', 'B. Clonus can only be demonstrated at the ankle', 'C. The root value of hip flexion is L4, L5', 'D. The root value of toe extension is L5']",D. The root value of toe extension is L5,professional,clinical_knowledge
Which of the following is true in peripheral neuropathy?,"['A. Sensory loss is demonstrated in a stocking distribution', 'B. The tone is increased bilaterally in the legs', 'C. Reflexes are very brisk with reinforcement', 'D. Weakness is more marked proximally than distally']",A. Sensory loss is demonstrated in a stocking distribution,professional,clinical_knowledge
Which of the following is true about the assessment of arm reflexes?,"['A. The root value of the biceps reflex is C5, C6', 'B. If no reflex is elicited when you tap a tendon it is documented as absent', 'C. The triceps tendon is struck in the antecubital fossa', 'D. Brisk finger jerks confirm a lower motor neurone lesion']","A. The root value of the biceps reflex is C5, C6",professional,clinical_knowledge
An allele that is masked is referred to as:,"['A. recessive.', 'B. redundant.', 'C. repressed.', 'D. reclusive.']",A. recessive.,professional,clinical_knowledge
Which of the following factors can affect enzyme activity?,"['A. Temperature.', 'B. pH.', 'C. The presence of certain metal ions.', 'D. All of the above.']",D. All of the above.,professional,clinical_knowledge
A person weighs 62 kg. Their drug dose is 15 mg/kg. How many grams is their dose? Choose one answer from the following:,"['A. 930', 'B. 93', 'C. 9.3', 'D. 0.93']",D. 0.93,professional,clinical_knowledge
The chain of survival has four links. Put the following list in the correct order: 1. Early defibrillation; 2. Early CPR; 3. Recognition and call for help early; 4. Post-resuscitation care.,"['A. 3, 1, 2, 4.', 'B. 3, 2, 1, 4.', 'C. 1, 2, 3, 4.', 'D. 2, 1, 3, 4.']","B. 3, 2, 1, 4.",professional,clinical_knowledge
What forms may the obligation of reparation take?,"['A. Reparation may take only the form of pecuniary compensation, including the interest', 'B. Reparation denotes only the physical restitution of the wrongful act', 'C. Reparation includes restitution, compensation, and satisfaction, either alone or alongside other forms of reparation', 'D. The form of reparation is a matter for the responsible State to decide']","C. Reparation includes restitution, compensation, and satisfaction, either alone or alongside other forms of reparation",professional,international_law
What is passive personality jurisdiction?,"['A. It is jurisdiction based on the nationality of the offender', 'B. It is jurisdiction based on where the offence was committed', 'C. It is jurisdiction based on the nationality of the victims', 'D. It is jurisdiction based on the country where the legal person was Registered']",C. It is jurisdiction based on the nationality of the victims,professional,international_law
What is an act jure gestionis?,"['A. Acts jure gestionis are those undertaken by States in a private capacity', 'B. All purchases by the State are acts jure gestionis', 'C. All acts undertaken by State corporations are jure gestionis', 'D. All conduct undertaken by government officials in their free time is considered jus gestionis.']",A. Acts jure gestionis are those undertaken by States in a private capacity,professional,international_law
When a reservation is considered as invalid under the law of treaties?,"['A. A reservation is invalid when the majority of the State parties objects to it', 'B. A reservation is invalid only when an international tribunal says so', 'C. A reservation is invalid only when is incompatible with a peremptory norm of international law (jus cogens)', 'D. A reservation is invalid when it is incompatible with the object and purpose of the treaty']",D. A reservation is invalid when it is incompatible with the object and purpose of the treaty,professional,international_law
What is the 'equitable result' in the law and practice of maritime delimitation?,"['A. It is the only method of delimitation that international courts and tribunals follow', 'B. An equitable result is what a judge or the arbitrator would decide ex aequo et bono, i.e. upon their discretion and in light of what they consider as fair and equitable in a delimitation case', ""C. It is the end result that all delimitations of areas of continental shelf and EEZ should achieve, after, however, drawing a provisional 'equidistance line' and adjusting the zone in the light of the relevant circumstances and the proportionality test."", 'D. Achieving an equitable result is an old method of delimitation which is currently not applicable']","C. It is the end result that all delimitations of areas of continental shelf and EEZ should achieve, after, however, drawing a provisional 'equidistance line' and adjusting the zone in the light of the relevant circumstances and the proportionality test.",professional,international_law
Under what circumstances do human rights violations taking place outside the territory of ECHR member States fall within the remit of the ECHR?,"['A. The ECHR applies outside Europe where human rights are violated by ECHR member States abroad', 'B. The ECHR applies extraterritorially in circumstances where a member State exercises effective control', 'C. The ECHR applies extraterritorially where a member State has contributed forces to a UN peacekeeping mission', 'D. The ECHR applies extraterritorially where human rights violations are taking place in former colonies of member States']",B. The ECHR applies extraterritorially in circumstances where a member State exercises effective control,professional,international_law
What is the judge ad hoc?,"['A. If a party to a contentious case before the ICJ does not have a national sitting as judge, it is entitled to nominate someone as a judge solely for that case, with the title of judge ad hoc', 'B. Judge ad hoc is the member of the bench of the ICJ with a casting vote', 'C. Judge ad hoc is a surrogate judge, in case a judge is disqualified or passes away', 'D. Judge ad hoc is the judge that each party will always nominate in every contentious case']","A. If a party to a contentious case before the ICJ does not have a national sitting as judge, it is entitled to nominate someone as a judge solely for that case, with the title of judge ad hoc",professional,international_law
What is an 'internationally wrongful conduct'?,"['A. An international wrongful conduct is an action or omission which is in breach of a rule of international criminal law', 'B. An international wrongful conduct is every breach of an international obligation of the State, whether attributable to it or not', 'C. An internationally wrongful conduct consists of an action or omission attributable to the State, which constitutes a breach of an international obligation of the State', 'D. An internationally wrongful conduct is the conduct that cannot be excused on grounds of necessity, force majeure etc.']","C. An internationally wrongful conduct consists of an action or omission attributable to the State, which constitutes a breach of an international obligation of the State",professional,international_law
What is jus cogens?,"['A. They are peremptory norms of international law, from which no derogations are allowed and which can never be altered even with the consent of the States', 'B. They are rules of international law that are laid down in multilateral treaties with a wide participation', 'C. They are the decisions of the UN Security Council', 'D. They are the rules of international law on which the ICJ founds its decisions']","A. They are peremptory norms of international law, from which no derogations are allowed and which can never be altered even with the consent of the States",professional,international_law
What is the 'optional; clause' in the ICJ Statute?,"['A. Optional clause is the clause in the ICJ Statute, which provides for the applicable law, according to the intention of the parties', 'B. Optional clause determines the intention of the parties to accept that the decision of the Court will be final and binding', 'C. Optional clause is the declaration deposited by a State, whereby it accepts the jurisdiction of the Court in respect of international legal disputes in relation to any other State accepting the same obligation.', 'D. Optional clause is the clause that the parties deposit, which sets out the procedure of the written and oral pleadings']","C. Optional clause is the declaration deposited by a State, whereby it accepts the jurisdiction of the Court in respect of international legal disputes in relation to any other State accepting the same obligation.",professional,international_law
What is the fundamental premise of monist theory?,"['A. Monism posits that international law is superior to domestic laws', 'B. Monism posits that international and domestic law are part of the same legal order', 'C. Monism posits that domestic laws are superior to international law', 'D. Monism posits that domestic and international law never clash']",B. Monism posits that international and domestic law are part of the same legal order,professional,international_law
When coastal States do enforce their criminal jurisdiction over foreign vessels in their ports?,"['A. Port States generally do not enforce their criminal jurisdiction over crimes that do not infringe their customs laws or disrupt peace and public order.', 'B. Port States enforce their jurisdiction in all cases of delinquent vessels', 'C. Port States enforce their jurisdiction only in respect of very serious crimes, such as drug trafficking', 'D. Port States are not entitled to enforce their jurisdiction over any foreign vessel']",A. Port States generally do not enforce their criminal jurisdiction over crimes that do not infringe their customs laws or disrupt peace and public order.,professional,international_law
Which rule of jus cogens was the first to be accepted explicitly as such by the ICJ?,"['A. The prohibition of the use of force', 'B. The prohibition of torture', 'C. The prohibition of genocide', 'D. The principle of self-determination']",C. The prohibition of genocide,professional,international_law
Who is an 'injured State' in the law of international responsibility?,"[""A. A State is 'injured' in case that it has suffered a damage from the internationally wrongful conduct"", ""B. A State is 'injured' in cases that there has been a violation of a peremptory norm of international law"", ""C. A State is 'injured' should it acknowledge the existence of the internationally wrongful conduct"", ""D. A State is 'injured' if the obligation breached was owed to it individually or if it was owed to a group of States, including that State, and it was specially affected""]","D. A State is 'injured' if the obligation breached was owed to it individually or if it was owed to a group of States, including that State, and it was specially affected",professional,international_law
What is the problem of 'fragmentation' of international law?,"['A. Fragmentation of international law concerns the possibility of different legal regimes apply the same rules of international law', 'B. It is possible for several legal regimes (ie foreign investment law and human rights law) to exist and develop in isolation of each other, ultimately culminating in the production of divergent rules of international law', 'C. Fragmentation is when States assume different interpretations of the same rule of international law', 'D. Fragmentation is when States disagree to abide by a certain rule of international law']","B. It is possible for several legal regimes (ie foreign investment law and human rights law) to exist and develop in isolation of each other, ultimately culminating in the production of divergent rules of international law",professional,international_law
Why is Bentham's account of sovereignty generally considered to be more sophisticated - and more acceptable - than Austin's?,"[""A. Because Bentham's Utilitarianism redeems his account of sovereignty."", 'B. Because Austin overlooks the significance of morality.', ""C. Because Bentham recognizes the possibility of limiting the sovereign's power."", ""D. Because Austin incorporates power-conferring rules into his concept of the sovereign's commands.""]",C. Because Bentham recognizes the possibility of limiting the sovereign's power.,professional,jurisprudence
Dworkin argues that it is only a conception of equality of resources that can secure the ideal of equality of welfare. How does he suggest this aspect of equality to be measured?,"[""A. When no-one would prefer another's bundle of resources to his or her own."", 'B. By reference to the ownership of private property.', 'C. By the amount of income tax paid by individuals.', 'D. When the community determines that equality has been achieved.']",A. When no-one would prefer another's bundle of resources to his or her own.,professional,jurisprudence
Why does the 'capability' approach to justice reject Rawls' theory?,"['A. Because it fails to address the actual capabilities people have to benefit from his theory of justice.', 'B. Because it ignores the duties of individuals.', 'C. Because it applies only to democratic societies.', 'D. Because it overlooks the importance of the courts.']",A. Because it fails to address the actual capabilities people have to benefit from his theory of justice.,professional,jurisprudence
On what grounds does John Finnis reject Hume's conception of practical reason?,"['A. That natural law corresponds to positive law.', 'B. That Hume is a legal positivist.', 'C. That syllogistic logic is false.', 'D. That human reason can help us to determine what constitutes a worthwhile life.']",D. That human reason can help us to determine what constitutes a worthwhile life.,professional,jurisprudence
"The ________ School of jurisprudence postulates that the law is based on what is ""correct.""","['A. Natural Law', 'B. Analytical', 'C. Historical', 'D. Sociological']",A. Natural Law,professional,jurisprudence
Which position does Rawls claim is the least likely to be adopted by the POP (people in the original position)?,"['A. The POP would choose equality above liberty.', ""B. The POP would opt for the 'maximin' strategy."", ""C. The POP would opt for the 'difference principle'."", ""D. The POP would reject the 'system of natural liberty.'""]",A. The POP would choose equality above liberty.,professional,jurisprudence
Adherence to precedent is called the doctrine of ________.,"['A. nolo contendere', 'B. stare decisis', 'C. substantial performance', 'D. commercial impracticability']",B. stare decisis,professional,jurisprudence
To claim that one has a prima facie duty to obey the law is to assert that:,"['A. One is under a duty to obey the law without exception, regardless of its content.', ""B. There is no duty to obey a law to which one hasn't agreed."", 'C. The duty applies only to those who are directly affected by the law in question.', 'D. The obligation arises independently of the precise legal provisions involved - unless there are grounds to justify a specific exception.']",D. The obligation arises independently of the precise legal provisions involved - unless there are grounds to justify a specific exception.,professional,jurisprudence
Which of the following quotations best describes the central thesis of difference feminism?,"[""A. There are fundamental differences between individual women.'"", ""B. Men and women have different conceptions of the feminist project.'"", ""C. Women look to context, whereas men appeal to neutral, abstract notions of justice.'"", ""D. Men are unable to comprehend their differences from women.'""]","C. Women look to context, whereas men appeal to neutral, abstract notions of justice.'",professional,jurisprudence
Who said that “Jurisprudence is the eye of law”,"['A. Maine', 'B. Savigny', 'C. Pound', 'D. Laski']",D. Laski,professional,jurisprudence
Kelsen’s theory of law is called pure theory because Kelsen :,"['A. Purely discussed jurisprudence only', 'B. Defined law in according with morality and purity', 'C. Separated law from religion, ethics, sociology and history', 'D. Discussed law purely in terms of justice']",A. Purely discussed jurisprudence only,professional,jurisprudence
Which statement best describes Tom Regan's 'sentimental anthropomorphicism' in support of animals rights?,"['A. Animals have inherent worth which entitles them to the absolute right to live their lives with respect and autonomy.', 'B. The social contract includes animals and their welfare.', 'C. The suffering of a few animals may in principle be justified by the pleasure of or benefit to the many.', 'D. Cruelty to animals is a reflection of the barbarity of a society.']",A. Animals have inherent worth which entitles them to the absolute right to live their lives with respect and autonomy.,professional,jurisprudence
Why does communitarianism resemble Aristotle's philosophy more than Kant's?,"['A. Because Aristotle justified slavery.', 'B. Because Kant failed to distinguish individual from social morality?', ""C. Because Aristotle believed that man is a 'social animal'"", 'D. Because Kant regarded the individual as unimportant.']",C. Because Aristotle believed that man is a 'social animal',professional,jurisprudence
The will theory of rights maintains that the enforcement of Y's duty requires the exercise of will by X. It assumes the correlativity of rights and duties. Which of the following succeeds in formulating the interest theory without this correlativity?,"[""A. Regarding X's interest as directly related to Y's duty."", 'B. Accepting that conferring right means that the interest represented by that right ought to be recognized.', 'C. Treating an interest as the exercise of choice.', 'D. Asserting that X has a right whenever the protection of his interest is recognized as a reason for imposing duties -only when they are actually imposed.']",B. Accepting that conferring right means that the interest represented by that right ought to be recognized.,professional,jurisprudence
Which of the following propositions would be rejected by those who describe themselves as critical legal theorists?,"['A. Law is politics.', 'B. Law is determinate.', 'C. Law reflects economic power.', 'D. Law is unstable.']",B. Law is determinate.,professional,jurisprudence
"A driver of a car negligently hit a pole causing injuries to his passenger. The passenger was rushed by ambulance to the hospital where he received treatment and surgery. While operating on the injured passenger, the surgeon negligently caused severe internal injuries to the patient. Can the passenger collect damages from the driver for the surgeon's negligence?","['A. Yes, because the malpractice of medical providers is usually considered within the ambit of foreseeable results stemming from an auto accident.', 'B. No, the chain of causation was broken by the malpractice, which was not foreseeable.', 'C. No, a plaintiff can never collect damages caused by an intervening negligent human force.', 'D. Yes, a plaintiff is entitled to all damages that flow after the initial accident occurs.']","A. Yes, because the malpractice of medical providers is usually considered within the ambit of foreseeable results stemming from an auto accident.",professional,law
"A woman was seven months pregnant with her first child. One afternoon, the woman was in the kitchen of her home preparing a snack when she glanced out the window and saw a horrible crime being committed. The woman watched in horror as a local gang member pulled out a handgun and used it to shoot the victim, a member of a rival gang. The gang member did not know anyone was witnessing his act of shooting the victim. The woman watched as the victim collapsed and fell dead on her neighbor's front lawn. As a result of her shock from viewing this horrible incident, the woman suffered a miscarriage. If the woman asserts a claim against the local gang member who shot the victim, the woman will","['A. recover, because she suffered a physical injury, rather than just emotional harm.', 'B. recover, because the gang member acted intentionally in shooting the victim.', 'C. not recover, because the woman was not within the zone of danger.', 'D. not recover, because the gang member was unaware that the woman was watching.']","D. not recover, because the gang member was unaware that the woman was watching.",professional,law
"A defendant in an automobile accident case is being sued by the estate of the driver of the other car. At trial, the defendant calls an eyewitness to the collision. The eyewitness testifies that after the crash, he immediately ran to the other driver's car to try to render assistance. The eyewitness observed the other driver covered with blood from the top of his head down to his toes. He was moaning, gasping, and crying out, ""I did not see the other car coming!"" The other driver died 10 minutes later. The estate's attorney objects to the eyewitness's testimony. The trial judge should rule that his testimony is","['A. admissible as a declaration against interest.', 'B. admissible as a dying declaration.', 'C. inadmissible as hearsay not within any recognized exception.', 'D. inadmissible, because this testimony cannot be admitted in civil cases. ']",B. admissible as a dying declaration.,professional,law
