question,choices,answer,level,subject
What is not a component of an agile organisation?,"['A. Market focus and position', 'B. Human resources: multi-skilling', 'C. Organisational structure', 'D. Project-based culture']",D. Project-based culture,college,management
Which writer was concerned with the reaction of workers to key characteristics of bureaucracies?,"['A. Merton', 'B. Weber', 'C. Gouldner', 'D. Mayo']",C. Gouldner,college,management
What is Frank Gilbreth`s work most noted for?,"['A. Working conditions', 'B. Time and motion studies', 'C. Work psychology', 'D. Work as a social setting']",B. Time and motion studies,college,management
What is the richest form of information?,"['A. Telephone', 'B. Face-to-face', 'C. E-mail', 'D. Video conference']",B. Face-to-face,college,management
What is not a purpose of an organisational structure?,"['A. To coordinate people and resources', 'B. To organise lines of communication', 'C. To formalise authority', ""D. To limit workers' rights""]",D. To limit workers' rights,college,management
Which one of the following is not a characteristic of a team?,"['A. Minimal and formal knowledge sharing', 'B. Collective output', 'C. Individual and collective responsibility', 'D. Fluid dimension to roles and tasks']",A. Minimal and formal knowledge sharing,college,management
What are the two main dimensions of the Ohio Studies into leadership?,"['A. Starting position and end position', 'B. Initial environment and changed environment', 'C. Organisational structure and conditioning', 'D. Initiating structure and considerations']",D. Initiating structure and considerations,college,management
The Hawthorn Studies are most associated with which writer?,"['A. Mary Parker Follett', 'B. Elton Mayo', 'C. Lillian Gilbreth', 'D. Frederick Taylor']",B. Elton Mayo,college,management
 Toyota's Prius and Honda's hybrid Civic are examples of technological products inspired by:,"['A. Style considerations in the Japanese automobile industry.', 'B. Social pressure to develop more fuel-efficient vehicles with fewer dangerous emissions.', 'C. The desire of many engineers to simply make interesting products.', ""D. The realization that Japanese people didn't need large, high-speed cars.""]",B. Social pressure to develop more fuel-efficient vehicles with fewer dangerous emissions.,college,marketing
" Once referred to as a multibrand policy, this branding strategy requires that each product offered by an organization is branded independently of all the others. This is known as:","['A. Individual branding.', 'B. Corporate brands.', 'C. Family branding.', 'D. Co-branding.']",A. Individual branding.,college,marketing
"Where the winning bidder obtains an unprofitable contract that he/she is duty bound to deliver because their bid price was set so low, this is known as:","[""A. Winner's curse."", ""B. Winner's price."", ""C. Winner's reward."", 'D. Loss-leader pricing.']",A. Winner's curse.,college,marketing
This is the sharing of meaning created through the transmission of information:,"['A. Communication.', 'B. Noise.', 'C. Transfer.', 'D. Understanding.']",A. Communication.,college,marketing
_______________can be defined as the aspect of our psyche that determines the way in which we respond to our environment in a relatively stable way over time.,"['A. Perception.', 'B. Personality.', 'C. Learning.', 'D. Memory.']",B. Personality.,college,marketing
" Which of the following is a stage in the new product development process, undertaken when a new product is tested with a sample of customers, or is launched in a specified geographical area, to judge customers' reactions prior to a national launch?","['A. Test marketing.', 'B. Focused marketing.', 'C. Live marketing.', 'D. Generic marketing.']",A. Test marketing.,college,marketing
 This pricing approach is used when the firm sets prices according to how much customers are prepared to pay:,"['A. Cost-oriented approach.', 'B. Value-oriented approach.', 'C. Competitor-oriented approach.', 'D. Demand-oriented approach.']",D. Demand-oriented approach.,college,marketing
 _______________ is concerned with the development of knowledge that is specific to the parties involved and is referred to as 'learning together'.,"['A. Dialogue.', 'B. Personal influencer.', 'C. Feedback.', 'D. Message.']",A. Dialogue.,college,marketing
"These are chains of organizations that are concerned with the management of the processes and activities involved in creating and moving products from producers and manufacturers to end-user customers. The organizations involved with any one journey, are collectively termed as a:","['A. Distribution.', 'B. Vendor.', 'C. Communication.', 'D. Selling.']",A. Distribution.,college,marketing
This is a hierarchy of effects or sequential model used to explain how advertising works:,"['A. ADD.', 'B. AIDA.', 'C. PESTLE.', 'D. SWOT.']",B. AIDA.,college,marketing
 The differentiation of a firm's products or services to promote environmental responsibility is referred to as:,"['A. Social branding.', 'B. Eco-branding.', 'C. Me-too branding.', 'D. Brand personality.']",B. Eco-branding.,college,marketing
"________ is the process of marketing accomplished or facilitated via the use of Internet technologies (e.g. web, email, intranet, extranets, etc.).","['A. Internet marketing.', 'B. Search marketing.', 'C. E-marketing.', 'D. Mobile marketing.']",A. Internet marketing.,college,marketing
" An approach that encompasses a wide range of relationships, not just with customers, but also those that organizations develop with suppliers, regulators, government, competitors, employees, and others, is referred to as:","['A. Market exchanges.', 'B. Service failure.', 'C. Relationship marketing.', 'D. Shared responsibility.']",C. Relationship marketing.,college,marketing
 A person who is in the position of attempting to satisfy their needs at the most basic level is operating at the level of Maslow's needs hierarchy called the need for:,"['A. Self-actualization.', 'B. Esteem.', 'C. Physiological needs.', 'D. Belongingness.']",C. Physiological needs.,college,marketing
"________________reflect a purchaser's high level of involvement in the purchase decision. There is high perceived risk in these decisions so consumers spend a great deal of time, care, and energy searching, formulating, and making the final decision.","['A. Durable goods.', 'B. Non-durable goods.', 'C. Convenience products.', 'D. Services.']",A. Durable goods.,college,marketing
"Which of the following are valid intervals of convergence for a power series?
(I) [−1, 3)
(II) (−∞, 0]
(III) [2, 2] ∪ [3, 3]
(IV) (−∞,∞)","['A. Only (II)', 'B. Only (IV )', 'C. (I) and (IV )', 'D. (II) and (III)']",C. (I) and (IV ),college,mathematics
Sofia and Tess will each randomly choose one of the 10 integers from 1 to 10. What is the probability that neither integer chosen will be the square of the other?,"['A. 0.64', 'B. 0.72', 'C. 0.81', 'D. 0.95']",D. 0.95,college,mathematics
"If f : (0, 1) → (0, 1], then which of the following could be TRUE?
I. f is one-to-one and onto.
II. The image of f is compact.
III. f is continuous, one-to-one, and onto.","['A. I only', 'B. II only', 'C. I and II only', 'D. I and III only']",C. I and II only,college,mathematics
The map x -> axa^2 of a group G into itself is a homomorphism if and only if,"['A. G is abelian', 'B. G = {e}', 'C. a^3 = e', 'D. a^2 = a']",C. a^3 = e,college,mathematics
Statement 1 |  Suppose ∑|a_i| diverges and ∑ a_i = 2. There is a rearrangement a_i_k of the terms such that ∑ a_i_k = 4. Statement 2 | There exists metric spaces X and Y with X closed and bounded and a continuous mapping f : X → Y such that f(X) is NOT “closed and bounded”.,"['A. True, True', 'B. True, False', 'C. False, True', 'D. False, False']","A. True, True",college,mathematics
"If one arch of the curve y = sin x is revolved around the x-axis, what's the volume of the generated solid?","['A. π^2 / 4', 'B. π^2 / 2', 'C. 2π', 'D. π^2']",B. π^2 / 2,college,mathematics
"Let x_1 = 1 and x_(n+1) = sqrt(3+2x_n) for all positive integers n. If it is assumed that {x_n} converges, then lim x_n =","['A. 3', 'B. e', 'C. sqrt(5)', 'D. 0']",A. 3,college,mathematics
"k digits are to be chosen at random (with repetitions allowed) from {0, 1, 2, 3, 4, 5, 6, 7, 8, 9}. What is the probability that 0 will not be chosen?","['A. (9/10)^k', 'B. (1/10)^k', 'C. (k-1)/k', 'D. 1/10']",A. (9/10)^k,college,mathematics
Which of the following circles has the greatest number of points of intersection with the parabola x^2 = y + 4 ?,"['A. x^2 + y^2 = 1', 'B. x^2 + y^2 = 2', 'C. x^2 + y^2 = 9', 'D. x^2 + y^2 = 16']",C. x^2 + y^2 = 9,college,mathematics
"What is the volume of the solid in xyz-space bounded by the surfaces y = x^2, y = 2 - x^2, z = 0, and z = y + 3?","['A. 8/3', 'B. 16/3', 'C. 32/3', 'D. 104/105']",C. 32/3,college,mathematics
"S(n) is a statement about positive integers n such that whenever S(k) is true, S(k + 1) must also be true. Furthermore, there exists some positive integer n0 such that S(n0) is not true. Of the following, which is the strongest conclusion that can be drawn?","['A. S(n0 + 1) is not true.', 'B. S(n0 - 1) is not true.', 'C. S(n) is not true for any n <= n0', 'D. S(n) is not true for any n >= n0']",C. S(n) is not true for any n <= n0,college,mathematics
"In the xy-plane, the graph of x^(log y) = y^log x is","['A. the open first quadrant', 'B. a closed curve', 'C. a ray in the open first quadrant', 'D. a single point']",A. the open first quadrant,college,mathematics
"Let R be a ring and let U and V be (two-sided) ideals of R. Which of the following must also be ideals of R ?
I. {u + v : u \in and v \in V}
II. {uv : u \in U and v \in V}
III. {x : x \in U and x \in V}","['A. II only', 'B. III only', 'C. I and II only', 'D. I and III only']",D. I and III only,college,mathematics
"Let I != A != -I, where I is the identity matrix and A is a real 2 x 2 matrix. If A = A^(-1), then the trace of A is","['A. 2', 'B. 1', 'C. 0', 'D. -1']",C. 0,college,mathematics
"Suppose X is a discrete random variable on the set of positive integers such that for each positive integer n, the probability that X = n is 1/2^n. If Y is a random variable with the same probability distribution and X and Y are independent, what is the probability that the value of at least one of the variables X and Y is greater than 3 ?","['A. 1/64', 'B. 15/64', 'C. 1/4', 'D. 3/8']",B. 15/64,college,mathematics
"In general, the higher the intensity of exercise, the greater the proportional contribution of:","['A. aerobic energy production.', 'B. anaerobic energy production.', ""C. the TCA cycle (Krebs' cycle) to the production of ATP."", 'D. the electron transfer chain to the production of ATP.']",B. anaerobic energy production.,college,medicine
"A psychology study run on a college campus was set up right outside of the gym on a weekday. Chocolate chip cookies were offered right outside the door, and then a sign was placed 15 feet further down the hall that asked people to avoid using the stairs, forcing them to go around in a longer hallway. There were no barriers to using the stairs other than the sign. The results returned, and it showed that individuals who took a sweet from the tray were twice as likely to use the longer hallway as individuals who refused. This is an example of what psychological concept?","['A. Learned helplessness', 'B. Insecure attachment', 'C. Ego depletion', 'D. Tyranny of choice']",C. Ego depletion,college,medicine
"A certain molecule acts by binding to cytochrome oxidase A3, the final enzyme in the electron transport chain. Administration of a large dose of this substance to a human would likely:","['A. Lead to death due to an inability of the cell to pass electrons to oxygen, thus stopping aerobic respiration and asphyxiating the cells.', 'B. Lead to death due to an inadequate supply of ADP to accept a phosphate group at the ATP synthase enzyme.', 'C. Have no effect as cells would switch which macronutrient they metabolize to circumvent the blocked biochemical pathway.', 'D. Increase the cell’s ATP production as negative feedback would cause the cell to up-regulate anaerobic pathways.']","A. Lead to death due to an inability of the cell to pass electrons to oxygen, thus stopping aerobic respiration and asphyxiating the cells.",college,medicine
"Cystic Fibrosis (CF) patients often have a loss of pancreas activity during their adolescent years. Loss of which enzyme, if isolated would lead to the most extensive effects on nutrient absorption?","['A. Lipase', 'B. Elastinogen', 'C. Trypsinogen', 'D. Carboxypeptidase']",C. Trypsinogen,college,medicine
"A patient comes into the ER looking extremely agitated. They are acting aggressive, and claiming they need medication or “bad things will happen”. What is the likely state of this patient’s dopamine system?","['A. There is decreased dopamine in the synaptic cleft.', 'B. There are decreased dopamine receptors on the post-synaptic membrane.', 'C. There is cell death in the areas with high dopamine cells.', 'D. There is seizure-like activity in the dopamine brain areas.']",B. There are decreased dopamine receptors on the post-synaptic membrane.,college,medicine
"A hedonic teenager of wayward morals, in one night, sequentially i) has consensual sexual intercourse with his sister, ii) leaves no tip at the bar, iii) has non-censual sexual relations with an unknown woman, and iv) vomits on the steps to the door of a local church. The teenager has violated society’s norms sequentially (to the greatest degree) on the order of:","['A. mores, mores, the law, mores', 'B. taboo, folkways, the law, and taboo', 'C. the law, folkways, folkways, and folkways', 'D. taboo, folkways, the law, and mores']","D. taboo, folkways, the law, and mores",college,medicine
Sodium bicarbonate ingestion improves middle distance running performance by:,"['A. elevating the pH and buffering capacity of the extracellular fluid allowing a faster efflux of hydrogen ions from muscle.', 'B. reducing the pH and buffering capacity of the extracellular fluid allowing a faster efflux of hydrogen ions from muscle.', 'C. elevating the pH and buffering capacity of the extracellular fluid allowing a faster influx of hydrogen ions into muscle.', 'D. elevating the pre-exercise muscle pH.']",A. elevating the pH and buffering capacity of the extracellular fluid allowing a faster efflux of hydrogen ions from muscle.,college,medicine
The process of translation requires the presence of:,"['A. mRNA, tRNA and ribosomes.', 'B. mRNA, ribosomes and RNA polymerase.', 'C. DNA, mRNA and RNA polymerase.', 'D. chromatin, DNA and amino acids.']","A. mRNA, tRNA and ribosomes.",college,medicine
Which of the following nucleotide bases is not found in RNA?,"['A. Thymine', 'B. Adenine', 'C. Uracil', 'D. Guanine']",A. Thymine,college,medicine
Approximately how many kJ of energy are expended if an athlete's steady-rate oxygen uptake averages 3.0 l/min for 5 minutes of exercise?,"['A. 60 kJ', 'B. 150 kJ', 'C. 300 kJ', 'D. 500 kJ']",C. 300 kJ,college,medicine
The sex of a child is dictated by the inheritance of:,"['A. the number of X chromosomes from the mother.', 'B. a recessive allele on the X chromosome.', 'C. a single Y chromosome from the mother.', 'D. a single Y chromosome from the father.']",D. a single Y chromosome from the father.,college,medicine
Fast-twitch fibres contain:,"['A. a relatively large number of mitochondria and low ATPase activity.', 'B. a relatively small number of mitochondria and low ATPase activity.', 'C. a relatively small number of mitochondria and high ATPase activity.', 'D. a relatively large number of mitochondria and high ATPase activity.']",C. a relatively small number of mitochondria and high ATPase activity.,college,medicine
"A race car attempting to jump a series of 8 buses is set up on a flat track with a ramp at the end. Engineers assigned to the project have determined that, in order to jump the buses, the car must reach a velocity of 130 km/h. If the distance of the track is 50m, at what rate must the car accelerate to reach this velocity?","['A. 13 m/s^2', 'B. 26 m/s^2', 'C. 7 m/s^2', 'D. 17 m/s^2']",A. 13 m/s^2,college,medicine
"Which of the following are steroid-based molecules?
I. Testosterone
II. Triglycerides
III. Progesterone
IV. DNA","['A. I only', 'B. I, II, and III', 'C. I and III', 'D. I, III, and IV']",C. I and III,college,medicine
The rate limiting enzyme of glycolysis is:,"['A. phosphorylase.', 'B. hexokinase.', 'C. pyruvate dehydrogenase.', 'D. phosphofructokinase.']",D. phosphofructokinase.,college,medicine
"For which of these two scenarios does the main character (who uses I/me/my) do something clearly morally wrong, according to ordinary moral standards in the US as of 2020? Scenario 1 | I sang to the baby as it slept peacefully. Scenario 2 | Sometimes I hide my grandpa's teeth because he loves a good prank.","['A. Wrong, Wrong', 'B. Wrong, Not wrong', 'C. Not wrong, Wrong', 'D. Not wrong, Not wrong']","D. Not wrong, Not wrong",college,moral_scenarios
"For which of these two scenarios does the main character (who uses I/me/my) do something clearly morally wrong, according to ordinary moral standards in the US as of 2020? Scenario 1 | I put my son in online classes because the local public school wasn't high-quality. Scenario 2 | I tried to assist a dementia patient at a nursing home.","['A. Wrong, Wrong', 'B. Wrong, Not wrong', 'C. Not wrong, Wrong', 'D. Not wrong, Not wrong']","D. Not wrong, Not wrong",college,moral_scenarios
"For which of these two scenarios does the main character (who uses I/me/my) do something clearly morally wrong, according to ordinary moral standards in the US as of 2020? Scenario 1 | I give customers I don't like a neutral expression. Scenario 2 | When my mother cut herself badly while washing dishes, I giggled.","['A. Wrong, Wrong', 'B. Wrong, Not wrong', 'C. Not wrong, Wrong', 'D. Not wrong, Not wrong']","C. Not wrong, Wrong",college,moral_scenarios
"For which of these two scenarios does the main character (who uses I/me/my) do something clearly morally wrong, according to ordinary moral standards in the US as of 2020? Scenario 1 | I took pictures of her was she was in the shower. Scenario 2 | I knocked over a standing stone at Stonehenge.","['A. Wrong, Wrong', 'B. Wrong, Not wrong', 'C. Not wrong, Wrong', 'D. Not wrong, Not wrong']","A. Wrong, Wrong",college,moral_scenarios
"For which of these two scenarios does the main character (who uses I/me/my) do something clearly morally wrong, according to ordinary moral standards in the US as of 2020? Scenario 1 | There were only 2 life jackets on the boat, so I made sure my 2 kids each had one. Scenario 2 | I found a wallet in the park and returned it to the owner.","['A. Wrong, Wrong', 'B. Wrong, Not wrong', 'C. Not wrong, Wrong', 'D. Not wrong, Not wrong']","D. Not wrong, Not wrong",college,moral_scenarios
"For which of these two scenarios does the main character (who uses I/me/my) do something clearly morally wrong, according to ordinary moral standards in the US as of 2020? Scenario 1 | My sister's bangs are crooked, so I will cut them straight. Scenario 2 | I ironed my sons clothes for his school dance.","['A. Wrong, Wrong', 'B. Wrong, Not wrong', 'C. Not wrong, Wrong', 'D. Not wrong, Not wrong']","D. Not wrong, Not wrong",college,moral_scenarios
"For which of these two scenarios does the main character (who uses I/me/my) do something clearly morally wrong, according to ordinary moral standards in the US as of 2020? Scenario 1 | I cut the bar patron off because he had to drive home. Scenario 2 | I keep the corpses in the garage because they would really stink up the house.","['A. Wrong, Wrong', 'B. Wrong, Not wrong', 'C. Not wrong, Wrong', 'D. Not wrong, Not wrong']","C. Not wrong, Wrong",college,moral_scenarios
"For which of these two scenarios does the main character (who uses I/me/my) do something clearly morally wrong, according to ordinary moral standards in the US as of 2020? Scenario 1 | I told people that vaccines caused autism so I could sell them snake oil. Scenario 2 | I fixed broken games slowly, so the customers would lose extra quarters.","['A. Wrong, Wrong', 'B. Wrong, Not wrong', 'C. Not wrong, Wrong', 'D. Not wrong, Not wrong']","A. Wrong, Wrong",college,moral_scenarios
"For which of these two scenarios does the main character (who uses I/me/my) do something clearly morally wrong, according to ordinary moral standards in the US as of 2020? Scenario 1 | I borrowed a book and took photos of some pages to remember them. Scenario 2 | I copied answers from a book during a closed book test at school.","['A. Wrong, Wrong', 'B. Wrong, Not wrong', 'C. Not wrong, Wrong', 'D. Not wrong, Not wrong']","C. Not wrong, Wrong",college,moral_scenarios
"For which of these two scenarios does the main character (who uses I/me/my) do something clearly morally wrong, according to ordinary moral standards in the US as of 2020? Scenario 1 | I wanted the white students in my college class to feel guilt for slavery so I had them put on chains and shackles and had them sing a slave song. Scenario 2 | I killed the child's hunger.","['A. Wrong, Wrong', 'B. Wrong, Not wrong', 'C. Not wrong, Wrong', 'D. Not wrong, Not wrong']","B. Wrong, Not wrong",college,moral_scenarios
"For which of these two scenarios does the main character (who uses I/me/my) do something clearly morally wrong, according to ordinary moral standards in the US as of 2020? Scenario 1 | I put the metal pieces into the washing machine. Scenario 2 | I poured a cup of hot coffee for my baby.","['A. Wrong, Wrong', 'B. Wrong, Not wrong', 'C. Not wrong, Wrong', 'D. Not wrong, Not wrong']","A. Wrong, Wrong",college,moral_scenarios
"For which of these two scenarios does the main character (who uses I/me/my) do something clearly morally wrong, according to ordinary moral standards in the US as of 2020? Scenario 1 | I answered the phone and hung up as soon as I heard the telemarketer start talking. Scenario 2 | I blew cigarette smoke towards the child's face.","['A. Wrong, Wrong', 'B. Wrong, Not wrong', 'C. Not wrong, Wrong', 'D. Not wrong, Not wrong']","C. Not wrong, Wrong",college,moral_scenarios
"For which of these two scenarios does the main character (who uses I/me/my) do something clearly morally wrong, according to ordinary moral standards in the US as of 2020? Scenario 1 | I went to the bank to cash a check with my own name on it. Scenario 2 | Whenever I hear the pleas to help children starving in Africa, I always change the channel.","['A. Wrong, Wrong', 'B. Wrong, Not wrong', 'C. Not wrong, Wrong', 'D. Not wrong, Not wrong']","D. Not wrong, Not wrong",college,moral_scenarios
"For which of these two scenarios does the main character (who uses I/me/my) do something clearly morally wrong, according to ordinary moral standards in the US as of 2020? Scenario 1 | I voted for the man who was innocent Scenario 2 | Me and my sister had a close sexual relationship.","['A. Wrong, Wrong', 'B. Wrong, Not wrong', 'C. Not wrong, Wrong', 'D. Not wrong, Not wrong']","C. Not wrong, Wrong",college,moral_scenarios
"For which of these two scenarios does the main character (who uses I/me/my) do something clearly morally wrong, according to ordinary moral standards in the US as of 2020? Scenario 1 | I washed my son's bed sheets with bleach. Scenario 2 | I tested out my laser pointer by aiming it at a helicopter.","['A. Wrong, Wrong', 'B. Wrong, Not wrong', 'C. Not wrong, Wrong', 'D. Not wrong, Not wrong']","C. Not wrong, Wrong",college,moral_scenarios
"What type of diet is recommended for weight maintenance?
","['A. Low protein and low GI', 'B. High protein and high GI', 'C. Low protein and high GI', 'D. High protein and low GI']",D. High protein and low GI,college,nutrition
"The following amino acids are all essential components of the diet:
","['A. leucine, methionine and threonine', 'B. proline, tyrosine and serine', 'C. valine, glycine and arginine', 'D. leucine, cysteine and glycine']","A. leucine, methionine and threonine",college,nutrition
"Which one of the following is a definition of glycaemic index?
","['A. The increase in blood glucose concentration after consuming the food.', 'B. The increase in blood glucose concentration after consuming the food compared with that after consuming an equivalent amount of white bread.', 'C. The increase in blood insulin concentration after consuming the food.', 'D. The increase in blood insulin concentration after consuming the food compared with that after consuming an equivalent amount of white bread.']",B. The increase in blood glucose concentration after consuming the food compared with that after consuming an equivalent amount of white bread.,college,nutrition
"These factors increase risk of osteoporotic fracture:
","['A. High bone mineral density', 'B. High body weight', 'C. High lean mass', 'D. Poor muscle strength']",D. Poor muscle strength,college,nutrition
"Which of the following are the recommended blood pressure and lipid goals for the prevention of cardiovascular disease in adults with diabetes?
","['A. BP < 140/90, Trig <150, LDL < 100', 'B. BP < 130/85, Trig < 300, LDL < 100', 'C. BP < 135/80, Trig < 200, LDL < 130', 'D. BP < 130/80, Trig <150, LDL < 100']","D. BP < 130/80, Trig <150, LDL < 100",college,nutrition
"What are the main enzyme systems for catalysing ethanol to acetaldehyde?
","['A. Alcohol dehydrogenase (ADH)', 'B. Catalase', 'C. Alcohol dehydrogenase (ADH), cytochrome P450 2E1 (CYP2EI), catalase', 'D. cytochrome P450 2E1 (CYP2EI)']","C. Alcohol dehydrogenase (ADH), cytochrome P450 2E1 (CYP2EI), catalase",college,nutrition
