question,choices,answer,level,subject
Find the order of the factor group (Z_4 x Z_12)/(<2> x <2>),"['A. 2', 'B. 3', 'C. 4', 'D. 12']",C. 4,college,abstract_algebra
Statement 1 | The homomorphic image of a cyclic group is cyclic. Statement 2 | The homomorphic image of an Abelian group is Abelian.,"['A. True, True', 'B. False, False', 'C. True, False', 'D. False, True']","A. True, True",college,abstract_algebra
Find the maximum possible order for an element of S_n for n = 10.,"['A. 6', 'B. 12', 'C. 30', 'D. 105']",C. 30,college,abstract_algebra
Statement 1 | Q is an extension field of Z_2. Statement 2 | Every non-constant polynomial over a field has a zero in some extension field.,"['A. True, True', 'B. False, False', 'C. True, False', 'D. False, True']","D. False, True",college,abstract_algebra
The set of all real numbers under the usual multiplication operation is not a group since,"['A. multiplication is not a binary operation', 'B. multiplication is not associative', 'C. identity element does not exist', 'D. zero has no inverse']",D. zero has no inverse,college,abstract_algebra
Statement 1 | For every positive integer n there is a cyclic group of order n. Statement 2 | Every finite cyclic group contains an element of every order that divides the order of the group.,"['A. True, True', 'B. False, False', 'C. True, False', 'D. False, True']","A. True, True",college,abstract_algebra
"Statement 1 | If H and K are subgroups of a group G, then |HK| = |H||K|/|H intersection K|. Statement 2 | A group of order 2p where p is an odd prime is cyclic or isomorphic to D_p.","['A. True, True', 'B. False, False', 'C. True, False', 'D. False, True']","A. True, True",college,abstract_algebra
"Statement 1 | For n > 1, the set {1,2, ..., n-1} is a group under multiplication modulo n. Statement 2 | There is an integer x such that 63x mod 100 = 1.","['A. True, True', 'B. False, False', 'C. True, False', 'D. False, True']","D. False, True",college,abstract_algebra
"Let A and B be sets, f: A -> B and g: B -> A be functions such that for all a \in A, g(f(a)) = a. Statement 1 | The function f must necessarily be injective. Statement 2 | The function f must necessarily be surjective.","['A. True, True', 'B. False, False', 'C. True, False', 'D. False, True']","C. True, False",college,abstract_algebra
Statement 1 | If H is a subgroup of G and a belongs to G then aH is a subgroup of G if and only if a is in H. Statement 2 | If H is a subgroup of G and a and b belong to G then aH = bH if and only if ab is in H.,"['A. True, True', 'B. False, False', 'C. True, False', 'D. False, True']","C. True, False",college,abstract_algebra
"Statement 1 | If aH is an element of a factor group, then |aH| divides |a|. Statement 2 | If H and K are subgroups of G then HK is a subgroup of G.","['A. True, True', 'B. False, False', 'C. True, False', 'D. False, True']","B. False, False",college,abstract_algebra
"Statement 1 | If f is a homomorphism from G to K and H is normal in G then f(H) is normal in K. Statement 2 | If f is a homomorphism from G to a group and H is finite subgroup of G, then |f(H)| divides |H|.","['A. True, True', 'B. False, False', 'C. True, False', 'D. False, True']","D. False, True",college,abstract_algebra
Find all c in Z_3 such that Z_3[x]/(x^2 + c) is a field.,"['A. 0', 'B. 1', 'C. 2', 'D. 3']",B. 1,college,abstract_algebra
"If A = {1, 2, 3} then relation S = {(1, 1), (2, 2)} is","['A. symmetric only', 'B. anti-symmetric only', 'C. both symmetric and anti-symmetric', 'D. an equivalence relation']",C. both symmetric and anti-symmetric,college,abstract_algebra
"Statement 1 | For finite groups G and H, |G + H| = |G||H|. (G + H is the internal direct product.) Statement 2 | If r divides m and s divides n then Z_m + Z_n has a subgroup isomorphic to Z_r + Z_s.","['A. True, True', 'B. False, False', 'C. True, False', 'D. False, True']","A. True, True",college,abstract_algebra
The thoracic cage is a structural unit important for which of the following functions?,"['A. Alimentation', 'B. Menstruation', 'C. Mentation', 'D. Respiration']",D. Respiration,college,anatomy
Which one of the following is brought about by activation of sympathetic nerves?,"['A. Contraction of bronchial smooth muscle.', 'B. Dilation of the pupil of the eye.', 'C. Increase in intestinal secretion', 'D. Decrease in heart rate']",B. Dilation of the pupil of the eye.,college,anatomy
Which of the following cavities are separated by the diaphragm?,"['A. Abdominal and pelvic', 'B. Cranial and spinal', 'C. Thoracic and abdominal', 'D. Pericardial and pleural']",C. Thoracic and abdominal,college,anatomy
Male hormones are produced by which of the following?,"['A. Glans penis', 'B. Prepuce', 'C. Prostate', 'D. Testes']",D. Testes,college,anatomy
The seventh cranial nerve supplies,"['A. taste buds on the posterior third of the tongue.', 'B. muscles of the soft palate.', 'C. muscles of the lower lip.', 'D. the parotid salivary gland.']",C. muscles of the lower lip.,college,anatomy
"A patient has a fracture in which the radius is bent but not displaced, and the skin is intact. This type of fracture is known as which of the following?","['A. Closed, greenstick', 'B. Complex, comminuted', 'C. Compound, transverse', 'D. Open, spiral']","A. Closed, greenstick",college,anatomy
Which of the following is located beneath the diaphragm in the left upper quadrant of the abdominal cavity?,"['A. Appendix', 'B. Duodenum', 'C. Spleen', 'D. Pancreas']",C. Spleen,college,anatomy
Which of the following structures should be visible on a dental panoramic radiograph?,"['A. The mandibular canal', 'B. The mandibular canal and maxillary sinus', 'C. The mandibular canal, maxillary sinus and hard palate', 'D. The mandibular canal, maxillary sinus, hard palate and zygomatic arch']","D. The mandibular canal, maxillary sinus, hard palate and zygomatic arch",college,anatomy
The head of the sixth rib articulates with,"['A. The inferior articular facet of T5 and superior articular facet of T6.', 'B. The inferior articular demifacet of T5 and superior articular facet of T6.', 'C. The inferior articular demifacet of T5 and the superior articular demifacet of T6.', 'D. The superior and inferior demifacets of T6.']",C. The inferior articular demifacet of T5 and the superior articular demifacet of T6.,college,anatomy
Which of the following is the point at which an impulse is transmitted from one neuron to another neuron?,"['A. Dendrite', 'B. Glial cell', 'C. Nerve center', 'D. Synapse']",D. Synapse,college,anatomy
Which of the following is flexible connective tissue that is attached to bones at the joints?,"['A. Adipose', 'B. Cartilage', 'C. Epithelial', 'D. Muscle']",B. Cartilage,college,anatomy
Tonsillar tissue is commonly found,"['A. on the posterior wall of the oropharynx.', 'B. under the mucosa of the ventral surface of the tongue.', 'C. between the palatoglossal and palatopharyngeal folds.', 'D. at all three sites.']",C. between the palatoglossal and palatopharyngeal folds.,college,anatomy
What is the embryological origin of the hyoid bone?,"['A. The first pharyngeal arch', 'B. The first and second pharyngeal arches', 'C. The second pharyngeal arch', 'D. The second and third pharyngeal arches']",D. The second and third pharyngeal arches,college,anatomy
Which of the following statements is true of the temporomandibular joint?,"['A. It has an articular disc of hyaline cartilage', 'B. Its articular surfaces are covered by hyaline cartilage', 'C. Proprioceptive information is carried by the chorda tympani and deep temporal nerves', 'D. Proprioceptive information is carried by the masseteric and auriculotemporal nerves.']",D. Proprioceptive information is carried by the masseteric and auriculotemporal nerves.,college,anatomy
The maxillary sinus,"['A. is lined by stratified squamous epithelium.', 'B. drains into the superior meatus of the nasal cavities.', 'C. is innervated by branches of the maxillary division of the trigeminal nerve.', 'D. Receives its blood supply from the first part of the maxillary artery.']",C. is innervated by branches of the maxillary division of the trigeminal nerve.,college,anatomy
Which is the least likely cause of death?,"['A. Being hit in the head by a bullet.', 'B. Being hit by a small meteorite.', 'C. Starvation during global winter caused by a major impact.', 'D. Driving while intoxicated without wearing seatbelts.']",B. Being hit by a small meteorite.,college,astronomy
What would weigh the most on the moon?,"['A. A kilogram of feathers', 'B. Five pounds of bricks as measured on Earth', 'C. Five kilograms of feathers', 'D. A kilogram of bricks']",C. Five kilograms of feathers,college,astronomy
Kirkwood gaps are observed in the main asteroid belt including at the position(s) where:,"['A. asteroids would orbit with a period half that of Jupiter', 'B. asteroids would orbit with a period twice that of Jupiter', 'C. asteroids would orbit with a period twice that of Mars', 'D. A and B']",A. asteroids would orbit with a period half that of Jupiter,college,astronomy
Which of the following is/are common feature(s) of all fresh (i.e. not eroded) impact craters formed on solid surfaces:,"['A. ejecta', 'B. raised rims', 'C. central peaks', 'D. A and B only']",D. A and B only,college,astronomy
If you lived on Venus what phases of the Earth would you see? (Assume your telescope can see through Venus’s thick clouds…),"['A. New first quarter full third quarter', 'B. Waning crescent New Waxing crescent', 'C. Waxing gibbous Full Waning gibbous', 'D. New only']",C. Waxing gibbous Full Waning gibbous,college,astronomy
"How do we think the ""hot Jupiters"" around other stars were formed?","['A. They where formed when their stars flung material out into the system in a process similar to planetary fission.', 'B. They formed as gas giants beyond the frost line and then migrated inwards.', 'C. They formed as dense rocky planets close to the star in the same orbits that they are seen today.', 'D. They formed as gas giants close to the star in the same orbits that they are seen today.']",B. They formed as gas giants beyond the frost line and then migrated inwards.,college,astronomy
In astronomy the concept of black bodies is very important to better calculate the radiation of stars. Which one is the correct definition of a black body?,"['A. An idealized physical object that reflects all electromagnetic radiation.', 'B. An idealized physical object that absorbs all electromagnetic radiation.', 'C. An idealized physical object that reflects all polarized radiation.', 'D. An idealized physical object that absorbs all polarized radiation.']",B. An idealized physical object that absorbs all electromagnetic radiation.,college,astronomy
How did Eratosthenes estimate the size of Earth in 240 B.C.?,"['A. By observing the duration of a solar eclipse.', ""B. By measuring the size of Earth's shadow on the Moon in a lunar eclipse."", 'C. By comparing the maximum altitude of the Sun in two cities at different latitudes at the same time on the same day.', 'D. By sending fleets of ships around Earth.']",C. By comparing the maximum altitude of the Sun in two cities at different latitudes at the same time on the same day.,college,astronomy
The International Space Station (ISS) circles the Earth approximately 410 km above the ground. Find the best estimate for the orbital speed of the ISS:,"['A. 19000 km/h', 'B. 21000 km/h', 'C. 28000 km/h', 'D. 32000 km/h']",C. 28000 km/h,college,astronomy
You’ve made a scientific theory that there is an attractive force between all objects. When will your theory be proven to be correct?,"['A. The first time you drop a bowling ball and it falls to the ground proving your hypothesis.', 'B. After you’ve repeated your experiment many times.', 'C. You can never prove your theory to be correct only “yet to be proven wrong”.', 'D. When you and many others have tested the hypothesis.']",C. You can never prove your theory to be correct only “yet to be proven wrong”.,college,astronomy
Which is not an essential requirement for life as we know it?,"['A. The ability to breathe oxygen', 'B. The ability to make energy from sunlight or to eat things that do', 'C. A source of organic molecules', 'D. A and B']",D. A and B,college,astronomy
"What is true for a type-Ia (""type one-a"") supernova?","['A. This type occurs in binary systems.', 'B. This type occurs in young galaxies.', 'C. This type produces gamma-ray bursts.', 'D. This type produces high amounts of X-rays.']",A. This type occurs in binary systems.,college,astronomy
Suppose the angular separation of two stars is smaller than the angular resolution of your eyes. How will the stars appear to your eyes?,"['A. You will not be able to see these two stars at all.', 'B. You will see two distinct stars.', 'C. The two stars will look like a single point of light.', 'D. The two stars will appear to be touching looking rather like a small dumbbell.']",C. The two stars will look like a single point of light.,college,astronomy
Why isn't there a planet where the asteroid belt is located?,"['A. A planet once formed here but it was broken apart by a catastrophic collision.', 'B. There was not enough material in this part of the solar nebula to form a planet.', 'C. There was too much rocky material to form a terrestrial planet but not enough gaseous material to form a jovian planet.', 'D. Resonance with Jupiter prevented material from collecting together to form a planet.']",D. Resonance with Jupiter prevented material from collecting together to form a planet.,college,astronomy
If you know both the actual brightness of an object and its apparent brightness from your location then with no other information you can estimate:,"['A. Its speed relative to you', 'B. Its composition', 'C. Its size', 'D. Its distance from you']",D. Its distance from you,college,astronomy
"In humans, a hereditary disorder called xeroderma pigmentosum (XP) can result in the inability to repair ultraviolet damage to DNA. Which of the following molecular lesions is most likely to accrue in individuals with XP?","['A. Thymine dimers', 'B. Deamination of cytosine', 'C. Depurination', 'D. Single strand DNA breaks']",A. Thymine dimers,college,biology
"In garden peas, the allele for tall plants (D) is completely dominant to the allele for dwarf plants (d) and the allele for violet flower color (W) is completely dominant to the allele for white flower color (w). In a cross between a tall violet plant, with the genotype DDWw, and a dwarf white plant, what phenotypic ratio of the progeny would be expected from this cross?","['A. All tall violet', 'B. 1 tall violet: 1 dwarf violet', 'C. 1 tall violet: 1 tall white: 1 dwarf violet: 1 dwarf white', 'D. 1 tall violet: 1 tall white']",D. 1 tall violet: 1 tall white,college,biology
Which of the following statements is true of air as compared to water?,"['A. Air provides more physical support.', 'B. Air has a higher O2 concentration.', 'C. Air offers more resistance to motion.', 'D. Air has more thermal inertia.']",B. Air has a higher O2 concentration.,college,biology
"An organism with a lobed thallus, rhizoids, and gemmae is a","['A. moss', 'B. liverwort', 'C. fern', 'D. mushroom']",B. liverwort,college,biology
A marine ecosystem region characterized by penetrance of solar radiation and upwelling of nutrients is the,"['A. bathyl zone', 'B. neritic zone', 'C. pelagic zone', 'D. benthyl zone']",B. neritic zone,college,biology
An organism belonging to the nekton is which one of the following?,"['A. Whale', 'B. Barnacle', 'C. Cyanobacterium', 'D. Protist']",A. Whale,college,biology
All of the following statements about muscle contraction are true EXCEPT:,"['A. The ends of actin filaments move closer together.', 'B. The length of myosin filaments does not change.', 'C. Calcium-troponin binding precedes actin-myosin binding.', 'D. Calcium-tropomyosin binding precedes actin-myosin binding.']",D. Calcium-tropomyosin binding precedes actin-myosin binding.,college,biology
"A plant that possesses swimming sperm, xylem with tracheids, independent gametophyte and sporophyte phases, and no seeds is probably most closely related to","['A. mosses', 'B. pines', 'C. ferns', 'D. liverworts']",C. ferns,college,biology
Which of the following must be true in order for evolution to have occurred?,"[""A. The frequencies of some alleles in a population's gene pool has changed over successive generations."", ""B. The frequencies of some alleles in a population's gene pool has changed during the organisms' lifetimes."", ""C. The frequencies of each allele in a population's gene pool has remained constant over successive generations."", ""D. The frequencies of each allele in an organism's genotype has remained constant within the organism's lifetime.""]",A. The frequencies of some alleles in a population's gene pool has changed over successive generations.,college,biology
"According to Hamilton’s rule, an altruistic trait can evolve if c < br, where c is the fitness cost of the altruistic behavior to the donor, b is the fitness benefit to the recipient, and r is the","['A. coefficient of relatedness', 'B. frequency of the altruistic allele', 'C. inbreeding coefficient', 'D. rate of reciprocity']",A. coefficient of relatedness,college,biology
"Nerve outgrowth from a developing neuron begins at the growth cone, located at the tip of the axon. Microspikes of the growth cone extend and retract in order to move the growth cone forward. Exposure of the neuron to cytochasalin B at this stage of development causes","['A. microtubules in the axon to undergo reversible dissociation', 'B. microtubules in the axon to undergo irreversible dissociation', 'C. microfilaments in the microspike to undergo reversible depolymerization', 'D. microfilaments in the microspike to undergo irreversible depolymerization']",C. microfilaments in the microspike to undergo reversible depolymerization,college,biology
Which of the following traits do prokaryotes and eukaryotes have in common?,"['A. A single chromosome carries the entire genome.', 'B. Chromosomes are circular.', 'C. Replication is bidirectional.', 'D. Molecular weight of respective DNA is comparable.']",C. Replication is bidirectional.,college,biology
"The process in which pioneer species colonize a bare substrate such as rock, sand, or glacial till is known as","['A. weathering', 'B. stabilizing succession', 'C. secondary succession', 'D. primary succession']",D. primary succession,college,biology
Which of the following is a correct statement about the cohesion-tension theory for the ascent of water in the xylem?,"['A. The evaporation of water from leaf mesophyll cells generates tension in the water column.', 'B. Water moves from a source region with high hydrostatic pressure to a sink region with low hydrostatic pressure.', 'C. The cohesion of water molecules is responsible for the formation of embolisms (air bubbles) in the water column.', 'D. Living cells of the xylem provide the main conduit for an ascent of water.']",A. The evaporation of water from leaf mesophyll cells generates tension in the water column.,college,biology
"Based on the characteristic population curves that result from plotting population growth of a species, the most effective means of controlling the mosquito population is to","['A. maintain the population at a point corresponding to the midpoint of its logistic curve', 'B. opt for zero population control once the K value of the curve has been reached', 'C. reduce the carrying capacity cif the environment to lower the K value', 'D. increase the mortality rate']",C. reduce the carrying capacity cif the environment to lower the K value,college,biology
What is the NMR frequency of 31P in a 20.0 T magnetic field?,"['A. 54.91 MHz', 'B. 239.2 MHz', 'C. 345.0 MHz', 'D. 2167 MHz']",C. 345.0 MHz,college,chemistry
"Suppose that the 13C nuclei in a molecule in a 600 MHz spectrometer can be 100% polarized (p = 1). If T1 = 5.0 s, how long does it take for p to reach a value equal to twice the thermal equilibrium polarization at 298 K?","['A. [The polarization relaxes exponentially: p(t) = [p(0) - peq]exp(-t/T1) + peq.]', 'B. 72.0 s', 'C. 56.6 s', 'D. 12.7 s']",B. 72.0 s,college,chemistry
Which of the following is always true of a spontaneous process?,"['A. The process is exothermic.', 'B. The process does not involve any work.', 'C. The entropy of the system increases.', 'D. The total entropy of the system plus surroundings increases.']",D. The total entropy of the system plus surroundings increases.,college,chemistry
A buffer is made from equal concentrations of a weak acid and its conjugate base. Doubling the volume of the buffer solution by adding water has what effect on its pH?,"['A. It has little effect.', 'B. It significantly increases the pH.', 'C. It significantly decreases the pH.', 'D. It changes the pH asymptotically to the pKa of the acid.']",A. It has little effect.,college,chemistry
"The 99Ru chemical shift of [Ru(H2O)6]2+ is 16,050 ppm relative to [Ru(CN)6]2- at 0 ppm. The electronic excitation energies of [Ru(H2O)6]2+, [Ru(CN)6]2- and [Ru(NH3)6]2+ are 18,900, 40,000 and 25,600 cm-1 respectively. Assuming that the chemical shift differences are dominated by paramagnetic currents, determine the chemical shift of [Ru(NH3)6]2+.","['A. 7,530 ppm', 'B. 8,090 ppm', 'C. 11,070 ppm', 'D. 14,840 ppm']","B. 8,090 ppm",college,chemistry
A substance that is NOT generally considered to be a toxic pollutant in water is,"['A. carbonic acid', 'B. a halogenated hydrocarbon', 'C. lead', 'D. mercury']",A. carbonic acid,college,chemistry
"The amplitude of a free induction decay drops to 25% of its initial intensity after 1.0 s. Assuming exponential relaxation and Ω = 0, determine the value of T2.","['A. 0.721 s', 'B. 0.750 s', 'C. 1.386 s', 'D. 1.661 s']",D. 1.661 s,college,chemistry
A set of hybrid sp^3 orbitals for a carbon atom is given above. Which of the following is NOT true about the orbitals?,"['A. The orbitals are degenerate.', 'B. The set of orbitals has a tetrahedral geometry.', 'C. These orbitals are constructed from a linear combination of atomic orbitals.', 'D. Each hybrid orbital may hold four electrons.']",D. Each hybrid orbital may hold four electrons.,college,chemistry
The Rydberg equation v = R_H(1/n_1^2 - 1/n_2^2) accurately predicts the UV-visible emission spectrum of the hydrogen atom. A form of the Rydberg equation may also be used to predict the UV-visible emission for all of the following EXCEPT,"['A. hydride ion, H−', 'B. deuterium atom, D', 'C. tritium atom, T', 'D. helium cation, He+']","A. hydride ion, H−",college,chemistry
"Which of the following procedures tend(s) to minimize the influence of random errors on measured results?
I. Signal averaging
II. Use of internal standards
III. Averaging the results from multiple samples","['A. I only', 'B. II only', 'C. III only', 'D. I and III only']",D. I and III only,college,chemistry
The solid-state structures of the principal allotropes of elemental boron are made up of which of the following structural units?,"['A. B12 icosahedra', 'B. B8 cubes', 'C. B6 octahedra', 'D. B4 tetrahedra']",A. B12 icosahedra,college,chemistry
Exact solutions of the Schrödinger equation CANNOT be obtained for a,"['A. simple harmonic oscillator', 'B. particle in a one-dimensional box', 'C. rigid rotor', 'D. helium atom']",D. helium atom,college,chemistry
Which of the following is a true statement about optical isomerism of complexes containing achiral ligands?,"['A. Square planar complexes can display optical isomerism only if all four ligands are identical.', 'B. Tetrahedral complexes never display optical isomerism.', 'C. Linear complexes can display optical isomerism when both ligands are different.', 'D. Octahedral complexes of monodentate ligands can display optical isomerism only when they have at least three different ligands.']",D. Octahedral complexes of monodentate ligands can display optical isomerism only when they have at least three different ligands.,college,chemistry
The strongest base in liquid ammonia is,"['A. NH3', 'B. NH2−', 'C. NH4+', 'D. N2H4']",B. NH2−,college,chemistry
A Cu(II) metal ion (giso = 2.12) produces four lines with a separation of 500 MHz between each line. Express the hyperfine splitting in field units of mT and the hyperfine coupling in units of wavenumbers.,"['A. 500 MHz = 0.185 mT = 0.29842 cm-1', 'B. 500 MHz = 16.850 mT = 0.01667 cm-1', 'C. 500 MHz = 32.953 mT = 0.76298 cm-1', 'D. 500 MHz = 45.672 mT = 2.86329 cm-1']",C. 500 MHz = 32.953 mT = 0.76298 cm-1,college,chemistry
"Which of the following statements about circuits is (are) true?
I. Combinational circuits may have feedback; sequential circuits do not.
II. Combinational circuits have a ""memoryless"" property; sequential circuits do not.
III. Both sequential and combinational circuits must be controlled by an external clock.","['A. I only', 'B. II only', 'C. I and II only', 'D. II and III only']",B. II only,college,computer_science
"Suppose that a certain software product has a mean time between failures of 10,000 hours and has a mean time to repair of 20 hours. If the product is used by 100 customers, what is its availability?","['A. 80%', 'B. 90%', 'C. 98%', 'D. 99.80%']",D. 99.80%,college,computer_science
"A particular parallel program computation requires 100 seconds when executed on a single processor. If 40 percent of this computation is ""inherently sequential"" (i.e., will not benefit from additional processors), then the theoretically best possible elapsed times for this program running with 2 and 4 processors, respectively, are","['A. 20 and 10 seconds', 'B. 30 and 15 seconds', 'C. 50 and 25 seconds', 'D. 70 and 55 seconds']",D. 70 and 55 seconds,college,computer_science
